{"$schema": "http://json-schema.org/schema#", "type": "object", "properties": {"kind": {"type": "string"}, "etag": {"type": "string"}, "items": {"type": "array", "items": {"type": "object", "properties": {"kind": {"type": "string"}, "etag": {"type": "string"}, "id": {"type": "string"}, "snippet": {"type": "object", "properties": {"publishedAt": {"type": "string", "format": "date-time"}, "channelId": {"type": "string"}, "title": {"type": "string"}, "description": {"type": "string"}, "thumbnails": {"type": "object", "properties": {"default": {"type": "object", "properties": {"url": {"type": "string"}, "width": {"type": "integer"}, "height": {"type": "integer"}}, "required": ["height", "url", "width"]}, "medium": {"type": "object", "properties": {"url": {"type": "string"}, "width": {"type": "integer"}, "height": {"type": "integer"}}, "required": ["height", "url", "width"]}, "high": {"type": "object", "properties": {"url": {"type": "string"}, "width": {"type": "integer"}, "height": {"type": "integer"}}, "required": ["height", "url", "width"]}, "standard": {"type": "object", "properties": {"url": {"type": "string"}, "width": {"type": "integer"}, "height": {"type": "integer"}}, "required": ["height", "url", "width"]}, "maxres": {"type": "object", "properties": {"url": {"type": "string"}, "width": {"type": "integer"}, "height": {"type": "integer"}}, "required": ["height", "url", "width"]}, "uhd": {"type": "object", "properties": {"url": {"type": "string"}, "width": {"type": "integer"}, "height": {"type": "integer"}}, "required": ["height", "url", "width"]}, "qhd": {"type": "object", "properties": {"url": {"type": "string"}, "width": {"type": "integer"}, "height": {"type": "integer"}}, "required": ["height", "url", "width"]}, "fhd": {"type": "object", "properties": {"url": {"type": "string"}, "width": {"type": "integer"}, "height": {"type": "integer"}}, "required": ["height", "url", "width"]}}}, "channelTitle": {"type": "string"}, "playlistId": {"type": "string"}, "position": {"type": "integer"}, "resourceId": {"type": "object", "properties": {"kind": {"type": "string"}, "videoId": {"type": "string"}}, "required": ["kind", "videoId"]}, "videoOwnerChannelTitle": {"type": "string"}, "videoOwnerChannelId": {"type": "string"}}, "required": ["channelId", "channelTitle", "description", "playlistId", "position", "publishedAt", "resourceId", "thumbnails", "title"]}, "contentDetails": {"type": "object", "properties": {"videoId": {"type": "string"}, "videoPublishedAt": {"type": "string", "format": "date-time"}}, "required": ["videoId"]}, "status": {"type": "object", "properties": {"privacyStatus": {"type": "string"}}, "required": ["privacyStatus"]}}, "required": ["contentDetails", "etag", "id", "kind", "snippet", "status"]}}, "pageInfo": {"type": "object", "properties": {"totalResults": {"type": "integer"}, "resultsPerPage": {"type": "integer"}}, "required": ["resultsPerPage", "totalResults"]}, "prevPageToken": {"type": "string"}, "nextPageToken": {"type": "string"}}, "required": ["etag", "items", "kind", "pageInfo"]}
